4099200412795			fr					"Boisson bio à l'avoine"		"Boisson bio à l'avoine / calcium"																						250ml			Naturactive	naturactive		"Aliments et boissons à base de végétaux, Boissons, Aliments d'origine végétale, Céréales et pommes de terre, Substituts de produits laitiers, Céréales et dérivés, Substituts du lait, Boissons à base de végétaux, Boissons végétales, Boissons végétales de céréales, Boissons à l'avoine"	en:plant-based-foods-and-beverages,en:beverages,en:plant-based-foods,en:cereals-and-potatoes,en:dairy-substitutes,en:cereals-and-their-products,en:milk-substitutes,en:plant-based-beverages,en:plant-based-milk-alternatives,en:cereal-based-drinks,en:oat-based-drinks	Bio, Végétarien, Végétalien, Union Végétarienne Européenne, Union Végétarienne Européenne Végétalien, Sans lactose	en:organic,en:vegetarian,en:vegan,en:european-vegetarian-union,en:european-vegetarian-union-vegan,en:no-lactose	Espagne, Suisse	en:spain,en:switzerland			0																			"Eau, 16 % avoine bio, huile de tournesol bio, algues rouges Lithothamnium calcareum, sel comestible. Produit UHT. Agiter avant l'emploi. L'emballage fermé est conservable sans réfrigération. Après l'ouverture conserver au réfrigérateur et consommer dans 3 à 4 jours."												100g	100g			53	kcal	1.4	g	0.3	g	9.3	g	7.7	g			0.5	g	0.1	g	0.04	g			53	kcal																																																																																																	en:plant-based-milk-substitutes	en:beverages,en:plant-based-milk-substitutes		unknown	b	1	c	52	1	18905	-5	-15	1	0															App - yuka, Apps, App - El CoCo
8436579070021			es					Civada avena																											eco solc	eco-solc		Alimentos y bebidas de origen vegetal, Bebidas, Alimentos de origen vegetal, Cereales y patatas, en:Dairy substitutes, Cereales y derivados, Sustitutos de la leche, Bebidas de origen vegetal, Bebidas vegetales, Bebidas de cereales, Bebidas de avena	en:plant-based-foods-and-beverages,en:beverages,en:plant-based-foods,en:cereals-and-potatoes,en:dairy-substitutes,en:cereals-and-their-products,en:milk-substitutes,en:plant-based-beverages,en:plant-based-milk-alternatives,en:cereal-based-drinks,en:oat-based-drinks	Ecológico, Ecológico UE, ES-ECO-025-NA, Punto Verde	en:organic,en:eu-organic,en:es-eco-025-na,en:green-dot	España	en:spain			0																															100g	100g			345	kcal	6.4000000953674	g	1.1000000238419	g	58.799999237061	g	0.60000002384186	g			11.199999809265	g							345	kcal																																																																																																	en:plant-based-milk-substitutes	en:beverages,en:plant-based-milk-substitutes		unknown	unknown		b	67	1	18905	-5	-15	1	15															App - yuka, Apps
8423352107074			es					No es Leche																							1 l		en:multilayer-composite, Tetra Pak, Tetra Brik	en:multilayer-composite,en:tetra-pak,en:tetra-brik	Yosoy	yosoy		Alimentos y bebidas de origen vegetal, Bebidas, Alimentos de origen vegetal, Leguminosas y derivados, Cereales y patatas, en:Dairy substitutes, Cereales y derivados, Sustitutos de la leche, Bebidas de origen vegetal, Bebidas vegetales, Bebidas de cereales, Leches de leguminosas, Bebidas de avena, Bebidas de soja	en:plant-based-foods-and-beverages,en:beverages,en:plant-based-foods,en:legumes-and-their-products,en:cereals-and-potatoes,en:dairy-substitutes,en:cereals-and-their-products,en:milk-substitutes,en:plant-based-beverages,en:plant-based-milk-alternatives,en:cereal-based-drinks,en:legume-based-drinks,en:oat-based-drinks,en:soy-based-drinks	Sin gluten, Fuente de calcio, FSC, FSC Mixto, Punto Verde, Sin azúcares añadidos, Sin aditivos, Fuente de vitamina B12, Fuente de vitamina D	en:no-gluten,en:calcium-source,en:fsc,en:fsc-mix,en:green-dot,en:no-added-sugar,en:no-additives,en:vitamin-b12-source,en:vitamin-d-source	España	en:spain	Bonpreu	bonpreu	0		España	en:spain								Liquats Vegetals SA Viladrau	liquats-vegetals-sa-viladrau					Agua, avena (10%), soja (8%), aceite de nabina, carbonato de calcio, sal marina, vitaminas D2 y B12									Soja	en:soybeans				100g	100g			67	kcal	3.3	g	0.3	g	5.7	g	1.2	g	1	g	3.1	g	0.15	g	0.06	g			67	kcal	1.5	g	1.5	g																	0.75	µg									0.38	µg					120	mg																						en:brick	en:tetra-brik																																			www.liquats.com	en:plant-based-milk-substitutes	en:beverages,en:plant-based-milk-substitutes	3	en:3-processed-foods	a	-2	a	89		18900	3	-4	0	0															App - Yuka, Apps, App - smoothie-openfoodfacts
8480024365347			es					Bebida de avena Barista																											Vemondo	vemondo		Alimentos y bebidas de origen vegetal, Bebidas, Alimentos de origen vegetal, Cereales y patatas, en:Dairy substitutes, Cereales y derivados, Sustitutos de la leche, Bebidas de origen vegetal, Bebidas vegetales, Bebidas de cereales, Bebidas de avena	en:plant-based-foods-and-beverages,en:beverages,en:plant-based-foods,en:cereals-and-potatoes,en:dairy-substitutes,en:cereals-and-their-products,en:milk-substitutes,en:plant-based-beverages,en:plant-based-milk-alternatives,en:cereal-based-drinks,en:oat-based-drinks	FSC, FSC Mixto, Punto Verde, Recicla-amarillo, Recicla-azul	en:fsc,en:fsc-mix,en:green-dot,es:recicla-amarillo,es:recicla-azul	España	en:spain			0											FSC-C014047	fsc-c014047																			100g	100g																																																																																																																									en:plant-based-milk-substitutes	en:beverages,en:plant-based-milk-substitutes		unknown	unknown		c	52	1	18905	-5	-15	1	0															App - Yuka, Apps, App - smoothie-openfoodfacts
8432425018520			es					Begetal avena															Bebida de avena UHT								1 l		TetraBrik	es:tetrabrik	Kaiku	kaiku		Alimentos y bebidas de origen vegetal, Bebidas, Alimentos de origen vegetal, Cereales y patatas, en:Dairy substitutes, Cereales y derivados, Sustitutos de la leche, Bebidas de origen vegetal, Bebidas vegetales, Bebidas de cereales, Bebidas de avena	en:plant-based-foods-and-beverages,en:beverages,en:plant-based-foods,en:cereals-and-potatoes,en:dairy-substitutes,en:cereals-and-their-products,en:milk-substitutes,en:plant-based-beverages,en:plant-based-milk-alternatives,en:cereal-based-drinks,en:oat-based-drinks	Sin conservantes, Punto Verde, Sin azúcares añadidos, Sin colorantes, Sin lactosa	en:no-preservatives,en:green-dot,en:no-added-sugar,en:no-colorings,en:no-lactose	España	en:spain			0																	Agua, _avena_ (15%) .									Avena	es:avena	Frutos de cáscara, en:Cereals	en:nuts,en:cereals		100g	100g	207	kJ	56	kcal	2.5	g	0.3	g	7.08	g	2.7	g	0.5	g	1.1	g	0.12	g	0.048	g			207	kJ																																																																																																	en:plant-based-milk-substitutes	en:beverages,en:plant-based-milk-substitutes	1	en:1-unprocessed-or-minimally-processed-foods	b	0	c	52	1	18905	-5	-15	1	0															App - yuka, Apps
8410509010448			es					Amandin Avena Oat Nature																											amandin	amandin		Alimentos y bebidas de origen vegetal, Bebidas, Alimentos de origen vegetal, Cereales y patatas, en:Dairy substitutes, Cereales y derivados, Sustitutos de la leche, Bebidas de origen vegetal, Bebidas vegetales, Bebidas de cereales, Bebidas de avena	en:plant-based-foods-and-beverages,en:beverages,en:plant-based-foods,en:cereals-and-potatoes,en:dairy-substitutes,en:cereals-and-their-products,en:milk-substitutes,en:plant-based-beverages,en:plant-based-milk-alternatives,en:cereal-based-drinks,en:oat-based-drinks	Ecológico, Vegetariano, Ecológico UE, Vegano, ES-ECO-019-CT, Unión Vegetariana Europea, Unión Vegetariana y vegana Europea, Sin azúcares añadidos	en:organic,en:vegetarian,en:eu-organic,en:vegan,en:es-eco-019-ct,en:european-vegetarian-union,en:european-vegetarian-union-vegan,en:no-added-sugar	España	en:spain			0																															100g	100g			41	kcal	0.8	g	0.2	g	7.8	g	5.6	g			0.7	g							41	kcal																																																																																																	en:plant-based-milk-substitutes	en:beverages,en:plant-based-milk-substitutes		unknown	unknown		b	67	1	18905	-5	-15	1	15															App - yuka, Apps
8480000861672			es					Bebida avena Calcio																									Material compuesto, Tetra Pak	en:composite-material,en:tetra-pak	Hacendado	hacendado		Alimentos y bebidas de origen vegetal, Bebidas, Alimentos de origen vegetal, Cereales y patatas, en:Dairy substitutes, Cereales y derivados, Sustitutos de la leche, Bebidas de origen vegetal, Bebidas vegetales, Bebidas de cereales, Bebidas de avena	en:plant-based-foods-and-beverages,en:beverages,en:plant-based-foods,en:cereals-and-potatoes,en:dairy-substitutes,en:cereals-and-their-products,en:milk-substitutes,en:plant-based-beverages,en:plant-based-milk-alternatives,en:cereal-based-drinks,en:oat-based-drinks	FSC, Sin azúcares añadidos	en:fsc,en:no-added-sugar	España	en:spain	Hacendado	hacendado	0											FSC-C014047	fsc-c014047					Agua, avena (10%), aceite de coco, maltodextrina, fosfato tricálcico (calcio), sal marina, estabilizantes (goma gellan y goma xantana) y Vitaminas: B2, B12 y D														100g	100g			52	kcal	2.5	g	2	g	6.8	g	3.6	g	0.56	g	0	g	0.115	g	0.046	g			52	kcal																																																																																																	en:plant-based-milk-substitutes	en:beverages,en:plant-based-milk-substitutes	4	en:4-ultra-processed-food-and-drink-products	b	1	c	52	1	18905	-5	-15	1	0															App - Yuka, Apps, App - smoothie-openfoodfacts
8023678729419			es					Avena 0% azucar																											Isola Bio	isola-bio		Alimentos y bebidas de origen vegetal, Bebidas, Alimentos de origen vegetal, Cereales y patatas, en:Dairy substitutes, Cereales y derivados, Sustitutos de la leche, Bebidas de origen vegetal, Bebidas vegetales, Bebidas de cereales, Bebidas de avena	en:plant-based-foods-and-beverages,en:beverages,en:plant-based-foods,en:cereals-and-potatoes,en:dairy-substitutes,en:cereals-and-their-products,en:milk-substitutes,en:plant-based-beverages,en:plant-based-milk-alternatives,en:cereal-based-drinks,en:oat-based-drinks			España	en:spain			0							"Abafoods S.r.l., Via Cà Mignola Nuova 1775 – 45021 - Badia Polesine (RO) Italia, Italy"	abafoods-s-r-l,via-ca-mignola-nuova-1775-45021-badia-polesine-ro-italia,italy			IT 05-122 CE	it-05-122-ec																			100g	100g			30	kcal	0.9	g	0.2	g	4.5	g	0	g	0.4	g	0.6	g	0.09	g	0.036	g			30	kcal																																																																																																	en:plant-based-milk-substitutes	en:beverages,en:plant-based-milk-substitutes		unknown	b	0	c	52	1	18905	-5	-15	1	0															App - yuka, Apps
8023678162544			es				Oat light																												Isola Bio	isola-bio		Alimentos y bebidas de origen vegetal, Bebidas, Alimentos de origen vegetal, Cereales y patatas, en:Dairy substitutes, Cereales y derivados, Sustitutos de la leche, Bebidas de origen vegetal, Bebidas vegetales, Bebidas de cereales, Bebidas de avena	en:plant-based-foods-and-beverages,en:beverages,en:plant-based-foods,en:cereals-and-potatoes,en:dairy-substitutes,en:cereals-and-their-products,en:milk-substitutes,en:plant-based-beverages,en:plant-based-milk-alternatives,en:cereal-based-drinks,en:oat-based-drinks	Ecológico, Fabricado en Italia, Sin lactosa	en:organic,en:made-in-italy,en:no-lactose	Francia, Italia, España	en:france,en:italy,en:spain			0							"Abafoods S.r.l., Via Cà Mignola Nuova 1775 – 45021 - Badia Polesine (RO) Italia, Italy"	abafoods-s-r-l,via-ca-mignola-nuova-1775-45021-badia-polesine-ro-italia,italy			IT 05-122 CE	it-05-122-ec		Wasser, Italienischer Hafer* (11%), Meersalz. (**-Biologisch).		water, italian oat* (11%), sea salt. (** - Organic).	agua, avena** (11%), sal marina. (** - de cultivo ecológico).		eau, avoine italienne** (11%), sel marin. (** - Biologique).		water, Italiaanse haver** (11%), zeezout. (** - Biologisch).		água, aveia italiana** (11%), sal marinho. (** - Biológico).								100g	100g			37	kcal	0.6	g	0.1	g	7	g	3.8	g	0.8	g	0.6	g	0.08	g	0.032	g			37	kcal																																																																																																	en:plant-based-milk-substitutes	en:beverages,en:plant-based-milk-substitutes	3	en:3-processed-foods	b	0	c	52	1	18905	-5	-15	1	0															App - yuka, Apps, app-elcoco
8480024833648			es					Bebida de avena																								250ml			Alteza	alteza		Alimentos y bebidas de origen vegetal, Bebidas, Alimentos de origen vegetal, Cereales y patatas, en:Dairy substitutes, Cereales y derivados, Sustitutos de la leche, Bebidas de origen vegetal, Bebidas vegetales, Bebidas de cereales, Bebidas de avena	en:plant-based-foods-and-beverages,en:beverages,en:plant-based-foods,en:cereals-and-potatoes,en:dairy-substitutes,en:cereals-and-their-products,en:milk-substitutes,en:plant-based-beverages,en:plant-based-milk-alternatives,en:cereal-based-drinks,en:oat-based-drinks			España	en:spain	Alteza	alteza	0																water, oats 10%, sunflower oil, sea salt	Agua, Avena 10%, aceite de girasol, sal marina											Frutos de cáscara	en:nuts		100g	100g			42	kcal	1.4	g	0.2	g	6.6	g	4.7	g			0.8	g	0.11	g	0.044	g			42	kcal																																																																																																	en:plant-based-milk-substitutes	en:beverages,en:plant-based-milk-substitutes	3	en:3-processed-foods	b	1	c	52	1	18905	-5	-15	1	0															App - yuka, Apps, App - InFood
5600798961030			es					Bebida de avena																														Alimentos y bebidas de origen vegetal, Bebidas, Alimentos de origen vegetal, Cereales y patatas, en:Dairy substitutes, Cereales y derivados, Sustitutos de la leche, Bebidas de origen vegetal, Bebidas vegetales, Bebidas de cereales, Bebidas de avena	en:plant-based-foods-and-beverages,en:beverages,en:plant-based-foods,en:cereals-and-potatoes,en:dairy-substitutes,en:cereals-and-their-products,en:milk-substitutes,en:plant-based-beverages,en:plant-based-milk-alternatives,en:cereal-based-drinks,en:oat-based-drinks	Sin gluten, Sin azúcares añadidos, Sin lactosa	en:no-gluten,en:no-added-sugar,en:no-lactose	España	en:spain			0																	Agua, avena (14%), estabilizante (goma gellan), sal marina. Naturalmente sin lactosa y sin gluten. Puede contener trazas de soja y frutos de cáscara.											Frutos de cáscara, Soja	en:nuts,en:soybeans		100g	100g			49	kcal	0.7	g	0.1	g	9.2	g	7.3	g	0.6	g	1.1	g	0.07	g	0.028	g			49	kcal																																																																																																	en:plant-based-milk-substitutes	en:beverages,en:plant-based-milk-substitutes	4	en:4-ultra-processed-food-and-drink-products	b	1	c	52	1	18905	-5	-15	1	0															App - yuka, Apps, App - El CoCo, App - smoothie-openfoodfacts
8436583958315			es					Essencials beguda vegetal de civada																														Alimentos y bebidas de origen vegetal, Bebidas, Alimentos de origen vegetal, Cereales y patatas, en:Dairy substitutes, Cereales y derivados, Sustitutos de la leche, Bebidas de origen vegetal, Bebidas vegetales, Bebidas de cereales, Bebidas de avena, en:Unsweetened plain oat-based drinks	en:plant-based-foods-and-beverages,en:beverages,en:plant-based-foods,en:cereals-and-potatoes,en:dairy-substitutes,en:cereals-and-their-products,en:milk-substitutes,en:plant-based-beverages,en:plant-based-milk-alternatives,en:cereal-based-drinks,en:oat-based-drinks,en:unsweetened-plain-oat-based-drinks	Punto Verde, Nutriscore, Nutriscore B	en:green-dot,en:nutriscore,en:nutriscore-grade-b	España	en:spain			0																	aigua, civada (14%), sal i estabilitzador (goma gellan). Pot contenir traces de soja i fruita seca. *Conté els sucres naturalment presents.														100g	100g			46	kcal	0.8	g	0.1	g	8.3	g	6.3	g	0.2	g	1.4	g	0.07	g	0.028	g			46	kcal																																																																																																	en:plant-based-milk-substitutes	en:beverages,en:plant-based-milk-substitutes	4	en:4-ultra-processed-food-and-drink-products	b	1	c	52	1	18905	-5	-15	1	0															App - Yuka, Apps, App - El CoCo
8431876289565			es					Bebida de avena calcio 0% azúcares añadidos																											Carrefour Bio, Carrefour	carrefour-bio,carrefour		Alimentos y bebidas de origen vegetal, Bebidas, Alimentos de origen vegetal, Cereales y patatas, en:Dairy substitutes, Cereales y derivados, Sustitutos de la leche, Bebidas de origen vegetal, Bebidas vegetales, Bebidas de cereales, Bebidas de avena	en:plant-based-foods-and-beverages,en:beverages,en:plant-based-foods,en:cereals-and-potatoes,en:dairy-substitutes,en:cereals-and-their-products,en:milk-substitutes,en:plant-based-beverages,en:plant-based-milk-alternatives,en:cereal-based-drinks,en:oat-based-drinks	Ecológico, Vegetariano, Ecológico UE, Vegano, ES-ECO-016-CL, Unión Vegetariana Europea, Unión Vegetariana y vegana Europea, Nutriscore, Nutriscore B, AB Agriculture Biologique	en:organic,en:vegetarian,en:eu-organic,en:vegan,en:es-eco-016-cl,en:european-vegetarian-union,en:european-vegetarian-union-vegan,en:nutriscore,en:nutriscore-grade-b,fr:ab-agriculture-biologique	España	en:spain	Carrefour	carrefour	0																	Agua, avena* (25%), alga marina calcárea: Lithothamnium calcareum, estabilizante (goma gellan) y sal. *Ingredientes procedentes de la agricultura ecológica.									Avena	es:avena	Frutos de cáscara, Soja	en:nuts,en:soybeans		100g	100g	210	kJ	50	kcal	0.8	g	0.1	g	9.3	g	5.9	g	0	g	1.3	g	0.07	g	0.028	g			210	kJ																																																			0	g																																													en:plant-based-milk-substitutes	en:beverages,en:plant-based-milk-substitutes	4	en:4-ultra-processed-food-and-drink-products	b	1	b	67	1	18905	-5	-15	1	15															App - yuka, Apps, Producers, Producer - carrefour-espana
8410509003136			es					Leche De Avena Con Coco Eco																							1 l		en:Brick	en:brick	Amandin	amandin		Alimentos y bebidas de origen vegetal, Bebidas, Alimentos de origen vegetal, Cereales y patatas, en:Dairy substitutes, Cereales y derivados, Sustitutos de la leche, Bebidas de origen vegetal, Bebidas vegetales, Bebidas de cereales, Bebidas de avena	en:plant-based-foods-and-beverages,en:beverages,en:plant-based-foods,en:cereals-and-potatoes,en:dairy-substitutes,en:cereals-and-their-products,en:milk-substitutes,en:plant-based-beverages,en:plant-based-milk-alternatives,en:cereal-based-drinks,en:oat-based-drinks	Ecológico, Vegetariano, Ecológico UE, Vegano, ES-ECO-019-CT, ES-ECO-020-CV, Unión Vegetariana Europea, Unión Vegetariana y vegana Europea, Sin azúcares añadidos, Sin lactosa	en:organic,en:vegetarian,en:eu-organic,en:vegan,en:es-eco-019-ct,en:es-eco-020-cv,en:european-vegetarian-union,en:european-vegetarian-union-vegan,en:no-added-sugar,en:no-lactose	España	en:spain			0																	Agua, avena (10 %), leche de coco (5%), aceite de girasol, aroma natural, estabilizante: goma gellan.									Gluten	en:gluten				100g	100g			49	kcal	2	g	0.8	g	7.3	g	4.6	g	0.6	g	0.5	g	0.12	g	0.048	g			49	kcal																																																												en:brick																																					en:plant-based-milk-substitutes	en:beverages,en:plant-based-milk-substitutes	4	en:4-ultra-processed-food-and-drink-products	b	1	b	72		18905	-5	-10	0	15															App - elcoco, App - yuka, Apps, App - El CoCo
4038375025966			es					Hafer choco																											Natumi	natumi		Alimentos y bebidas de origen vegetal, Bebidas, Alimentos de origen vegetal, Cereales y patatas, en:Dairy substitutes, Cereales y derivados, Sustitutos de la leche, Bebidas de origen vegetal, Bebidas vegetales, Bebidas de cereales, Bebidas de avena, en:Cocoa oat-based drinks	en:plant-based-foods-and-beverages,en:beverages,en:plant-based-foods,en:cereals-and-potatoes,en:dairy-substitutes,en:cereals-and-their-products,en:milk-substitutes,en:plant-based-beverages,en:plant-based-milk-alternatives,en:cereal-based-drinks,en:oat-based-drinks,en:cocoa-oat-based-drinks	Vegetariano, Vegano, Sin lactosa	en:vegetarian,en:vegan,en:no-lactose	España	en:spain			0																															100g	100g			42	kcal	1.3	g	0.2	g	12.8	g	9.8	g			0.9	g	0.8	g	0.32	g			42	kcal																																																																																																	en:plant-based-milk-substitutes	en:beverages,en:plant-based-milk-substitutes		unknown	c	5	c	52	1	18905	-5	-15	1	0															App - yuka, Apps
4056489355724			es					Bebida de avena con chocolate																											Lidl,Vemondo	lidl,vemondo		Alimentos y bebidas de origen vegetal, Bebidas, Alimentos de origen vegetal, Cereales y patatas, en:Dairy substitutes, Cereales y derivados, Sustitutos de la leche, Bebidas de origen vegetal, Bebidas vegetales, Bebidas de cereales, Bebidas de avena, en:Cocoa oat-based drinks	en:plant-based-foods-and-beverages,en:beverages,en:plant-based-foods,en:cereals-and-potatoes,en:dairy-substitutes,en:cereals-and-their-products,en:milk-substitutes,en:plant-based-beverages,en:plant-based-milk-alternatives,en:cereal-based-drinks,en:oat-based-drinks,en:cocoa-oat-based-drinks			España	en:spain			0																	Agua, 10% avena, azúcar, 1% cacao desgrasado*, sales cálcicas de ácido ortofosfórico, estabilizantes: goma gellan, agar-agar; aroma, sal, vitamina D (ergocalciferol).														100g	100g			51	kcal	0.7	g	0.2	g	10	g	7.7	g			1.1	g	0.07	g	0.028	g			51	kcal																																																																																																	en:plant-based-milk-substitutes	en:beverages,en:plant-based-milk-substitutes	4	en:4-ultra-processed-food-and-drink-products	b	1	c	52	1	18905	-5	-15	1	0															App - Yuka, Apps, App - El CoCo
280836600130			es					Bebida de Avena																							1 l				"bonÀrea"	bonarea		Alimentos y bebidas de origen vegetal, Bebidas, Alimentos de origen vegetal, Cereales y patatas, en:Dairy substitutes, Cereales y derivados, Sustitutos de la leche, Bebidas de origen vegetal, Bebidas vegetales, Bebidas de cereales, Bebidas de avena	en:plant-based-foods-and-beverages,en:beverages,en:plant-based-foods,en:cereals-and-potatoes,en:dairy-substitutes,en:cereals-and-their-products,en:milk-substitutes,en:plant-based-beverages,en:plant-based-milk-alternatives,en:cereal-based-drinks,en:oat-based-drinks			España	en:spain	"bonÀrea"	bonarea	0																	Agua, AVENA (14 %), fosfato tricálcico, estabilizante (goma gellan), sal marina y vitamina D.														100g	100g			49	kcal	0.7	g	0	g	10	g	7	g	0	g	0.6	g	0.06	g	0.024	g			49	kcal																																																																																																	en:plant-based-milk-substitutes	en:beverages,en:plant-based-milk-substitutes	4	en:4-ultra-processed-food-and-drink-products	b	1	c	52	1	18905	-5	-15	1	0															App - Yuka, Apps
8422584315691			es					Avena y cacao																											Ecocesta	ecocesta		Alimentos y bebidas de origen vegetal, Bebidas, Alimentos de origen vegetal, Cereales y patatas, en:Dairy substitutes, Cereales y derivados, Sustitutos de la leche, Bebidas de origen vegetal, Bebidas vegetales, Bebidas de cereales, Bebidas de avena, en:Cocoa oat-based drinks	en:plant-based-foods-and-beverages,en:beverages,en:plant-based-foods,en:cereals-and-potatoes,en:dairy-substitutes,en:cereals-and-their-products,en:milk-substitutes,en:plant-based-beverages,en:plant-based-milk-alternatives,en:cereal-based-drinks,en:oat-based-drinks,en:cocoa-oat-based-drinks	Ecológico, Ecológico UE, IT-BIO-007	en:organic,en:eu-organic,en:it-bio-007	España	en:spain			0																	Agua, avena* 11% cacao&quot; bajo en grasa de comercio justo 1,5%, aceite de girasol prensado en frío. sal marina, espesante: goma quar&quot; - goma xantana. 1)-De cultivo ecológico. Contiene gluten.									Gluten	en:gluten				100g	100g			48	kcal	1.8	g	0.39	g	7.4	g	4.8	g	0.2	g	1.1	g	0.08	g	0.032	g			48	kcal																																																																																																	en:plant-based-milk-substitutes	en:beverages,en:plant-based-milk-substitutes	4	en:4-ultra-processed-food-and-drink-products	b	1	b	67	1	18905	-5	-15	1	15															App - yuka, Apps, App - El CoCo
8423352106817			es					Chocoavena																											YOSOY	yosoy		Alimentos y bebidas de origen vegetal, Bebidas, Alimentos de origen vegetal, Cereales y patatas, en:Dairy substitutes, Cereales y derivados, Sustitutos de la leche, Bebidas de origen vegetal, Bebidas vegetales, Bebidas de cereales, Bebidas de avena, en:Cocoa oat-based drinks	en:plant-based-foods-and-beverages,en:beverages,en:plant-based-foods,en:cereals-and-potatoes,en:dairy-substitutes,en:cereals-and-their-products,en:milk-substitutes,en:plant-based-beverages,en:plant-based-milk-alternatives,en:cereal-based-drinks,en:oat-based-drinks,en:cocoa-oat-based-drinks	Sin aditivos	en:no-additives	España	en:spain			0																	Agua, avena (22%), cacao ((1,3%), avellanas tostadas (0,7%), carbonato cálcico, alga Choondrus crispus, vitamina D.									Gluten, Frutos de cáscara	en:gluten,en:nuts				100g	100g	325	kJ	69	kcal	1.2	g	0.2	g	12	g	7.9	g	1.1	g	2.1	g	0.05	g	0.02	g			325	kJ																																																																																																	en:plant-based-milk-substitutes	en:beverages,en:plant-based-milk-substitutes	1	en:1-unprocessed-or-minimally-processed-foods	a	-1	c	52	1	18905	-5	-15	1	0															App - elcoco, App - yuka, Apps, App - El CoCo
