20659318			en				Bebida de avena calcio	Bebida de avena calcio										Bebida de avena calcio					Bebida de avena enriquecida con calcio y vitamina D								1 l	250 ml	Tetra Brik, es:Ultrapasteurizado	es:tetra-brik,es:ultrapasteurizado	Vemondo	vemondo		Plant-based foods and beverages, Beverages, Plant-based foods, Cereals and potatoes, Dairy substitutes, Cereals and their products, Milk substitutes, Plant-based beverages, Plant-based milk alternatives, Cereal-based drinks, Unsweetened beverages, Oat-based drinks	en:plant-based-foods-and-beverages,en:beverages,en:plant-based-foods,en:cereals-and-potatoes,en:dairy-substitutes,en:cereals-and-their-products,en:milk-substitutes,en:plant-based-beverages,en:plant-based-milk-alternatives,en:cereal-based-drinks,en:unsweetened-beverages,en:oat-based-drinks	Vegetarian, Vegan, 100% vegetable, European Vegetarian Union, European Vegetarian Union Vegan, FSC, FSC Mix, Green Dot, No added sugar	en:vegetarian,en:vegan,en:100-vegetable,en:european-vegetarian-union,en:european-vegetarian-union-vegan,en:fsc,en:fsc-mix,en:green-dot,en:no-added-sugar	Spain	en:spain	Lidl	lidl	0							Burgos,Burgos (provincia),Castilla y León,España	burgos,burgos-provincia,castilla-y-leon,espana			"NIF: A-09022252,FABRICANTE Y ENVASADOR:,FRÍAS NUTRICIÓN S.A.,PE RTENE EC A:,GRUPO FRÍAS"	nif-a-09022252,fabricante-y-envasador,frias-nutricion-s-a,pe-rtene-ec-a,grupo-frias				water, 14% oats, calcium salts of orthophosphoric acid, vitamin d, salt and stabilizer: gellan gum,	Agua, 14% avena, sales cálcicas de ácido ortofosfórico, vitamina D, sal y estabilizante: goma gellan,									es:Avena	es:avena	Nuts, Soybeans	en:nuts,en:soybeans		100g	100g	196	kJ	46	kcal	0.8	g	0.1	g	8.3	g	6.3	g	0.2	g	1.4	g	0.07	g	0.028	g			196	kJ																					0.75	µg															120	mg																						en:brick	en:tetra-brik																																				en:plant-based-milk-substitutes	en:beverages,en:plant-based-milk-substitutes	4	en:4-ultra-processed-food-and-drink-products	b	1	b	63		18905	-5	-4	0	0															App - yuka, Apps, App - InFood, App - smoothie-openfoodfacts
7394376665028			en				The Original Oat Drink Semi	Oat drink																							1L	100ml	Composite-carton, Hdpe-lid	en:composite-carton,en:hdpe-lid	Oatly!	oatly		Plant-based foods and beverages, Beverages, Plant-based foods, Cereals and potatoes, Dairy substitutes, Cereals and their products, Milk substitutes, Plant-based beverages, Plant-based milk alternatives, Cereal-based drinks, Oat-based drinks	en:plant-based-foods-and-beverages,en:beverages,en:plant-based-foods,en:cereals-and-potatoes,en:dairy-substitutes,en:cereals-and-their-products,en:milk-substitutes,en:plant-based-beverages,en:plant-based-milk-alternatives,en:cereal-based-drinks,en:oat-based-drinks	Vegetarian, Vegan, Carbon footprint, FSC, FSC Mix, Carbon footprint	en:vegetarian,en:vegan,en:carbon-footprint,en:fsc,en:fsc-mix,en:carbon-footprint	Spain, United Kingdom	en:spain,en:united-kingdom	Sainsbury's,Tesco	sainsbury-s,tesco	0											FSC-C014047	fsc-c014047				water, oats 10%, rapeseed oi1, acidity regulator (dipotassium phosphate), minerals (calcium carbonate, potassium iodide), salt, vitamins (d2, riboflavin, b12)										Gluten	en:gluten				100g	100g	191	kJ	46	kcal	1.5	g	0.2	g	6.6	g	4.1	g	0.8	g	1	g	0.1	g	0.04	g			191	kJ																					1.5	µg			0.21	mg					0.38	µg			151	mg	120	mg																	460	g			1	en:brick	en:composite-material	en:recycle			1	en:bottle-cap	en:hdpe-2-high-density-polyethylene	en:recycle																													en:plant-based-milk-substitutes	en:beverages,en:plant-based-milk-substitutes	3	en:3-processed-foods	b	0	c	56		18905	-5	-11	0	0															App - yuka, Apps, App - elcoco, App - El CoCo, App - Horizon, App - InFood, App - IsVe, App - smoothie-openfoodfacts
7394376615986			fr							Bebida de avena sabor chocolate con calcio y vitaminas																					1L				Oatly	oatly		"Aliments et boissons à base de végétaux, Boissons, Aliments d'origine végétale, Céréales et pommes de terre, Substituts de produits laitiers, Céréales et dérivés, Substituts du lait, Boissons à base de végétaux, Boissons végétales, Boissons végétales de céréales, Boissons à l'avoine"	en:plant-based-foods-and-beverages,en:beverages,en:plant-based-foods,en:cereals-and-potatoes,en:dairy-substitutes,en:cereals-and-their-products,en:milk-substitutes,en:plant-based-beverages,en:plant-based-milk-alternatives,en:cereal-based-drinks,en:oat-based-drinks			France, Espagne	en:france,en:spain			0																															100g	100g			65	kcal	1.5	g	0.2	g	11	g	6.8	g	1.1	g	1.3	g	0.16	g	0.064	g			65	kcal																																																																																																	en:plant-based-milk-substitutes	en:beverages,en:plant-based-milk-substitutes		unknown	b	0	c	52	1	18905	-5	-15	1	0															App - elcoco, App - yuka, Apps, App - El CoCo
8402001014352			es																																Hacendado	hacendado		Alimentos y bebidas de origen vegetal, Bebidas, Alimentos de origen vegetal, Cereales y patatas, en:Dairy substitutes, Cereales y derivados, Sustitutos de la leche, Bebidas de origen vegetal, Bebidas vegetales, Bebidas de cereales, Bebidas de avena, Chocolate y avena sin azúcares añadidos	en:plant-based-foods-and-beverages,en:beverages,en:plant-based-foods,en:cereals-and-potatoes,en:dairy-substitutes,en:cereals-and-their-products,en:milk-substitutes,en:plant-based-beverages,en:plant-based-milk-alternatives,en:cereal-based-drinks,en:oat-based-drinks,es:chocolate-y-avena-sin-azucares-anadidos	FSC, FSC Mixto, Punto Verde, Sin azúcares añadidos	en:fsc,en:fsc-mix,en:green-dot,en:no-added-sugar	España	en:spain			0											FSC-C014047	fsc-c014047					"E Agua, avena (gluten) (9%), cacao (1,3%), aceite vegetal (nabina), carbonato cálcico, estabilizante (goma gellan), sal marina, espesante (goma guar), edulcorantes (acesulfamo K y sucralosa), vitaminas B12 y D2. Puede contener trazas de frutos de cáscara y/o de soja. PÁgua, aveia (glúten) (9%), cacau (1,3%), óleo vegetal (canola), carbonato de cálcio, estabilizador (goma gelana), sal marinho, espessante (goma de guar), adoçantes (acessulfame K e sucralose), vitaminas B12 y D2. Pode conter vestígios de nozes e/ou soja. Valor Azúcares/Açúcares Fibra alimentaria/Fibra Proteínas Sal Vitaminas y minerales/ Vitaminas e sais minerais Energético/Energia Grasas/Lípidos de las cuales/dos quais: - Saturadas/Saturados - Monoinsaturadas/Monoinsaturados Poliinsaturadas/Polinsaturados Hidratos de Carbono de los cuales/dos quais: Vitamina B12 Vitamina D2 Calcio/Cálcio 100 ml **VRN: Valor de Referencia de Nutrientes/ Valor de Referência do Nutriente. 185 kJ 44 kcal 1,9 g 0,3 g 1,1 g 0,5 g 5,1 g 2,4 g 1,0 g 1,2 g 0,15 g (**VRN) 0,38 µg (15%) 0,75 µg (15%) 120 mg (15%) Peso Neto/ Líquido: 1L 3"									Gluten	en:gluten	Gluten	en:gluten		100g	100g	185	kJ	44	kcal	1.9	g	0.3	g	5.1	g	2.4	g	1	g	1.2	g	0.15	g	0.06	g			185	kJ																																																																																																	en:plant-based-milk-substitutes	en:beverages,en:plant-based-milk-substitutes	4	en:4-ultra-processed-food-and-drink-products	a	-1	c	52	1	18905	-5	-15	1	0															App - smoothie-openfoodfacts, Apps
5411188130079			en		Barista Hafer		Barista Oat	Provamel Barista		Barista Oat. Hafer.			Barista Oat. Hafer.																		1 L		Tetra Pak, es:Produkt, fr:Brique en carton	en:tetra-pak,es:produkt,fr:brique-en-carton	Provamel	provamel		Plant-based foods and beverages, Beverages, Plant-based foods, Cereals and potatoes, Dairy substitutes, Cereals and their products, Milk substitutes, Plant-based beverages, Plant-based milk alternatives, Cereal-based drinks, Oat-based drinks	en:plant-based-foods-and-beverages,en:beverages,en:plant-based-foods,en:cereals-and-potatoes,en:dairy-substitutes,en:cereals-and-their-products,en:milk-substitutes,en:plant-based-beverages,en:plant-based-milk-alternatives,en:cereal-based-drinks,en:oat-based-drinks	"Organic, Vegetarian, EU Organic, Non-EU Agriculture, Vegan, EG-Öko-Verordnung, BE-BIO-01, Certified B Corporation, EU Agriculture, EU/non-EU Agriculture, FSC, No added sugar, No lactose, The Vegan Society, Triman"	en:organic,en:vegetarian,en:eu-organic,en:non-eu-agriculture,en:vegan,de:eg-öko-verordnung,en:be-bio-01,en:certified-b-corporation,en:eu-agriculture,en:eu-non-eu-agriculture,en:fsc,en:no-added-sugar,en:no-lactose,en:the-vegan-society,fr:triman	Germany, Spain	en:germany,en:spain			0											FSC-C014047	fsc-c014047		Haferbasis* (97,5%) (Wasser, Hafer* (11,9%)), Sonnenblumenöl*, Agavenfaser*, Erbsenprotein*, Meersalz. *=aus kontrolliert biologischem Anbau		Oat base (97,5%) (Water, Oat 11.9%), Sunflower oil, Agave fibre, Pea protein, Sea salt.	base de avena* (agua, avena* (11,9%)), aceite de girasol*, fibra de agave*, proteína de guisante*, sal marina. * = procedentes de la agricultura ecológica.		Base d'avoine* (97,5%) (eau, avoine* (11,9%)), huile de tournesol*, fibre d'agave*, protéine de pois*, sel marin de table. = issues de l'agriculture biologique		Haverbasis* (97,5%) (water, haver* (11,9%)), zonnebloemolie*, agavevezel*, erwteneiwit*, zeezout. = afkomstig van biologische landbouw					Gluten	en:gluten				100g	100g			47	kcal	1.4	g	0.5	g	7.9	g	3.8	g	0.3	g	0.8	g	0.09	g	0.036	g			47	kcal																																																											1	en:brick	en:tetra-pak				1	en:brick	en:tetra-pak			1	en:bottle-cap	en:plastic																									en:plant-based-milk-substitutes	en:beverages,en:plant-based-milk-substitutes	3	en:3-processed-foods	b	0	b	73		18905	-5	-9	0	15															App - yuka, Apps, App - Open Food Facts, App - smoothie-openfoodfacts
9020200017012			es					Hafer glutenfrei		Hafer glutenfrei																					1litro				Joya	joya		Alimentos y bebidas de origen vegetal, Bebidas, Alimentos de origen vegetal, Cereales y patatas, en:Dairy substitutes, Cereales y derivados, Sustitutos de la leche, Bebidas de origen vegetal, Bebidas vegetales, Bebidas de cereales, Bebidas de avena	en:plant-based-foods-and-beverages,en:beverages,en:plant-based-foods,en:cereals-and-potatoes,en:dairy-substitutes,en:cereals-and-their-products,en:milk-substitutes,en:plant-based-beverages,en:plant-based-milk-alternatives,en:cereal-based-drinks,en:oat-based-drinks	"Sin gluten, Ecológico, Vegetariano, Ecológico UE, Vegano, AT-BIO-301, DE-ÖKO-001, Sin azúcares añadidos"	en:no-gluten,en:organic,en:vegetarian,en:eu-organic,en:vegan,en:at-bio-301,en:de-oko-001,en:no-added-sugar	Francia, Alemania, España	en:france,en:germany,en:spain			0																			Base d'avoine&quot; 99,5% (eau, avoine&quot; complète sans gluten 11,5%); huile de tournesol&quot;; sel. (&quot; agriculture biologique contrôlée).												100g	100g			42	kcal	0.80000001192093	g	0.10000000149012	g	7.6999998092651	g	4.5	g			0.69999998807907	g	0.090000003576279	g	0.0360000014305116	g			42	kcal																																																																																																	en:plant-based-milk-substitutes	en:beverages,en:plant-based-milk-substitutes	3	en:3-processed-foods	b	0	b	67	1	18905	-5	-15	1	15															App - elcoco, App - yuka, Apps, App - El CoCo, App - Speisekammer
4038375024983			de		Hafer Drink Calcium																										1 l		Tetra Pak	en:tetra-pak	Natumi	natumi		Pflanzliche Lebensmittel und Getränke, Getränke, Milchprodukte, Pflanzliche Lebensmittel, Getreide und Kartoffeln, en:Dairy substitutes, Getreideprodukte, Milchersatz, Pflanzliche Getränke, Milchgetränke, Pflanzenmilch, Getreidemilch, Hafermilch	en:plant-based-foods-and-beverages,en:beverages,en:dairies,en:plant-based-foods,en:cereals-and-potatoes,en:dairy-substitutes,en:cereals-and-their-products,en:milk-substitutes,en:plant-based-beverages,en:dairy-drinks,en:plant-based-milk-alternatives,en:cereal-based-drinks,en:oat-based-drinks	"Bio, Vegetarisch, EU-Öko-Verordnung, Vegan, DE-ÖKO-013, Laktosefrei, AB Agriculture Biologique, en:Bio, en:EU-Landwirtschaft, en:EU-Öko-Verordnung, en:Laktosefrei, en:Ohne Zuckerzusatz, en:Vegetarisch, fr:EU-Öko-Verordnung, fr:eu-oko-verordnung"	en:organic,en:vegetarian,en:eu-organic,en:vegan,en:de-oko-013,en:no-lactose,fr:ab-agriculture-biologique,en:bio,en:eu-landwirtschaft,en:eu-oko-verordnung,en:laktosefrei,en:ohne-zuckerzusatz,en:vegetarisch,fr:eu-oko-verordnung,fr:eu-oko-verordnung	"Österreich, Frankreich, Deutschland, Spanien"	en:austria,en:france,en:germany,en:spain			0														Wasser, Vollkornhafer* (16% ), Sonnenblumenöl, Meeresalge: Lithotham - nium calcareum; Meersalz.*aus kontrolliert ökologischem Anbau.**Enthält natürlich Zucker aus der Haferfermentation. Vor Genuss schütteln. Nach dem Offnen im Kühlschrank aufbewahren und innerhalb von 4 Tagen aufbrauchen. Mindestens haltb bis: siehe Oberseite. KEINE SPEZIFISCHE SAUGLINGSANFANGSNAHRUNG.												Gluten	en:gluten				100g	100g			50	kcal	1.4	g	0.3	g	8.9	g	5.8	g	0.5	g	0.5	g	0.1	g	0.04	g			50	kcal																																					120	mg																						en:brick	en:tetra-pak																																				en:plant-based-milk-substitutes	en:beverages,en:plant-based-milk-substitutes		unknown	b	1	b	78		18905	-5	-4	0	15															App - elcoco, App - yuka, Apps, App - El CoCo, App - Open Food Facts
8480000239334			es					Bebida De Avena 100% Vegetal																											Hacendado	hacendado		Alimentos y bebidas de origen vegetal, Bebidas, Alimentos de origen vegetal, Cereales y patatas, en:Dairy substitutes, Cereales y derivados, Sustitutos de la leche, Bebidas de origen vegetal, Bebidas vegetales, Bebidas de cereales, Bebidas de avena	en:plant-based-foods-and-beverages,en:beverages,en:plant-based-foods,en:cereals-and-potatoes,en:dairy-substitutes,en:cereals-and-their-products,en:milk-substitutes,en:plant-based-beverages,en:plant-based-milk-alternatives,en:cereal-based-drinks,en:oat-based-drinks	FSC, FSC Mixto, Sin azúcares añadidos	en:fsc,en:fsc-mix,en:no-added-sugar	España	en:spain			0											FSC-C014047	fsc-c014047					Agua, avena (15%).														100g	100g	189	kJ	45	kcal	0.8	g	0.2	g	8.2	g	5.5	g	0.4	g	1	g	0	g	0	g			189	kJ																																																																																																	en:plant-based-milk-substitutes	en:beverages,en:plant-based-milk-substitutes	1	en:1-unprocessed-or-minimally-processed-foods	b	1	c	52	1	18905	-5	-15	1	0															App - elcoco, Apps, App - yuka, App - El CoCo
3256226680985			fr							Boisson végétale saveur avoine																					1 l				U	u		"Aliments et boissons à base de végétaux, Boissons, Aliments d'origine végétale, Céréales et pommes de terre, Substituts de produits laitiers, Céréales et dérivés, Substituts du lait, Boissons à base de végétaux, Boissons végétales, Boissons végétales de céréales, Boissons à l'avoine, Boissons végétales d'orge"	en:plant-based-foods-and-beverages,en:beverages,en:plant-based-foods,en:cereals-and-potatoes,en:dairy-substitutes,en:cereals-and-their-products,en:milk-substitutes,en:plant-based-beverages,en:plant-based-milk-alternatives,en:cereal-based-drinks,en:oat-based-drinks,en:barley-based-drinks	en:FSC, Transformé en France	en:fsc,en:transformed-in-france	France, Espagne	en:france,en:spain	Magasins U	magasins-u	0																			Eau, AVOINE 10%, inuline, huile de tournesol, carbonate de calcium, maltodextrine, sel marin, stabilisant : gomme gellane, riboflavine (vitamine b 2), vitamines B12, d.							Gluten	en:gluten				100g	100g	200	kJ	48	kcal	1.8	g	0.1	g	7.1	g	3.4	g	1.2	g	0.5	g	0.1	g	0.04	g			200	kJ																					0	g			0.21	mg					0	g					120	mg																																																											en:plant-based-milk-substitutes	en:beverages,en:plant-based-milk-substitutes	4	en:4-ultra-processed-food-and-drink-products	a	-1	c	52	1	18905	-5	-15	1	0															Producer - Systeme U, Producers, App - elcoco, App - yuka, Apps, App - El CoCo
24044769			es					Bebida de avena 0 azúcares																							1L				Aldi	aldi		Alimentos y bebidas de origen vegetal, Bebidas, Alimentos de origen vegetal, Cereales y patatas, en:Dairy substitutes, Cereales y derivados, Sustitutos de la leche, Bebidas de origen vegetal, Bebidas vegetales, Bebidas de cereales, Bebidas de avena	en:plant-based-foods-and-beverages,en:beverages,en:plant-based-foods,en:cereals-and-potatoes,en:dairy-substitutes,en:cereals-and-their-products,en:milk-substitutes,en:plant-based-beverages,en:plant-based-milk-alternatives,en:cereal-based-drinks,en:oat-based-drinks	Vegetariano, Vegano, Unión Vegetariana Europea, Unión Vegetariana y vegana Europea, FSC, FSC Mixto, Sin azúcares añadidos	en:vegetarian,en:vegan,en:european-vegetarian-union,en:european-vegetarian-union-vegan,en:fsc,en:fsc-mix,en:no-added-sugar	España	en:spain			0											FSC-C014047	fsc-c014047					Agua, avena (15%), aceite de girasol alto oleico.											Frutos de cáscara	en:nuts		100g	100g			55	kcal	1.7	g	0.3	g	9.2	g	6.5	g	0.5	g	0.9	g	0.05	g	0.02	g			55	kcal																																																																																																	en:plant-based-milk-substitutes	en:beverages,en:plant-based-milk-substitutes	3	en:3-processed-foods	b	1	c	52	1	18905	-5	-15	1	0															App - yuka, Apps, App - smoothie-openfoodfacts
8480017235619			es				Bebida de avena origen natural	Bebida de avena																											Dia	dia		Alimentos y bebidas de origen vegetal, Bebidas, Alimentos de origen vegetal, Cereales y patatas, en:Dairy substitutes, Cereales y derivados, Sustitutos de la leche, Bebidas de origen vegetal, Bebidas vegetales, Bebidas de cereales, Bebidas de avena	en:plant-based-foods-and-beverages,en:beverages,en:plant-based-foods,en:cereals-and-potatoes,en:dairy-substitutes,en:cereals-and-their-products,en:milk-substitutes,en:plant-based-beverages,en:plant-based-milk-alternatives,en:cereal-based-drinks,en:oat-based-drinks	FSC, FSC Mixto	en:fsc,en:fsc-mix	España	en:spain			0											FSC-C014047	fsc-c014047				water and oats (16%)	Agua y avena (16 %)											Frutos de cáscara	en:nuts		100g	100g			49	kcal	0.8	g	0.2	g	9.5	g	6.6	g			0.9	g	0.01	g	0.004	g			49	kcal																																																																																																	en:plant-based-milk-substitutes	en:beverages,en:plant-based-milk-substitutes	1	en:1-unprocessed-or-minimally-processed-foods	b	1	c	52	1	18905	-5	-15	1	0															App - yuka, Apps, App - El CoCo, App - Open Food Facts, App - InFood
8480000239327			es					Bebida de avena																								100g			Hacendado	hacendado		Alimentos y bebidas de origen vegetal, Bebidas, Alimentos de origen vegetal, Cereales y patatas, en:Dairy substitutes, Cereales y derivados, Sustitutos de la leche, Bebidas de origen vegetal, Bebidas vegetales, Bebidas de cereales, Bebidas de avena	en:plant-based-foods-and-beverages,en:beverages,en:plant-based-foods,en:cereals-and-potatoes,en:dairy-substitutes,en:cereals-and-their-products,en:milk-substitutes,en:plant-based-beverages,en:plant-based-milk-alternatives,en:cereal-based-drinks,en:oat-based-drinks	FSC, FSC Mixto	en:fsc,en:fsc-mix	España	en:spain	Mercadona	mercadona	0																	Agua, avena (15%)														100g	100g			45	kcal	0.8	g	0.2	g	8.2	g	5.5	g	0.4	g	1	g	0.01	g	0.004	g			45	kcal																																																																																																	en:plant-based-milk-substitutes	en:beverages,en:plant-based-milk-substitutes	1	en:1-unprocessed-or-minimally-processed-foods	b	1	c	52	1	18905	-5	-15	1	0															App - elcoco, App - yuka, Apps, App - El CoCo
8410297161711			es					Leche de avena															Bebida de avena U.H.T. enriquecida con calcio y vitamina D								1 l		Tetra Brik, UHT	es:tetra-brik,es:uht	Central Lechera Asturiana	central-lechera-asturiana		Alimentos y bebidas de origen vegetal, Bebidas, Alimentos de origen vegetal, Leguminosas y derivados, Cereales y patatas, en:Dairy substitutes, Cereales y derivados, Sustitutos de la leche, Bebidas de origen vegetal, Bebidas vegetales, Leches vegetales en polvo, Bebidas de cereales, Leches de leguminosas, Leches de cereales en polvo, Bebidas no azucaradas, Bebidas de avena, Bebidas de soja, Leches de avena en polvo	en:plant-based-foods-and-beverages,en:beverages,en:plant-based-foods,en:legumes-and-their-products,en:cereals-and-potatoes,en:dairy-substitutes,en:cereals-and-their-products,en:milk-substitutes,en:plant-based-beverages,en:plant-based-milk-alternatives,en:powdered-plant-milks,en:cereal-based-drinks,en:legume-based-drinks,en:powdered-cereal-milks,en:unsweetened-beverages,en:oat-based-drinks,en:soy-based-drinks,en:powdered-oat-milks	Bajo o sin azúcar, Vegetariano, Sin conservantes, Vegano, 100% vegetal, Unión Vegetariana Europea, Unión Vegetariana y vegana Europea, FSC, FSC Mixto, Punto Verde, Sin azúcares añadidos, Sin colorantes, Sin aromas, Sin lactosa, Nutriscore, Nutriscore B, Baja en grasas, Baja en grasas saturadas	en:low-or-no-sugar,en:vegetarian,en:no-preservatives,en:vegan,en:100-vegetable,en:european-vegetarian-union,en:european-vegetarian-union-vegan,en:fsc,en:fsc-mix,en:green-dot,en:no-added-sugar,en:no-colorings,en:no-flavors,en:no-lactose,en:nutriscore,en:nutriscore-grade-b,es:baja-en-grasas,es:baja-en-grasas-saturadas	España	en:spain	Ahorramás,Carrefour,Alcampo,Condis,Eroski,Hipercor,El Corte Inglés	ahorramas,carrefour,alcampo,condis,eroski,hipercor,el-corte-ingles	0											FSC-C014047	fsc-c014047					agua, _avena_ (gluten) (14%), estabilizante (goma gellan), vitamina D, carbonato cálcico.									Gluten, Avena, Avena	en:gluten,es:avena,es:avena	Frutos de cáscara	en:nuts		100g	100g	192	kJ	45	kcal	0.8	g	0.2	g	7.7	g	5	g	0.7	g	1.3	g	0	g	0	g			192	kJ																					0.75	µg															120	mg																						en:brick	en:tetra-brik																																			https://www.alpro.com/es/productos/bebidas/avena/original	en:plant-based-milk-substitutes	en:beverages,en:plant-based-milk-substitutes	4	en:4-ultra-processed-food-and-drink-products	b	1	a	81		18900	-5	-4	0	0															App - yuka, Apps
8435037810025			es					Bebida de Avena Bio																											Sol Natural	sol-natural		Alimentos y bebidas de origen vegetal, Bebidas, Alimentos de origen vegetal, Cereales y patatas, en:Dairy substitutes, Cereales y derivados, Sustitutos de la leche, Bebidas de origen vegetal, Bebidas vegetales, Bebidas de cereales, Bebidas de avena	en:plant-based-foods-and-beverages,en:beverages,en:plant-based-foods,en:cereals-and-potatoes,en:dairy-substitutes,en:cereals-and-their-products,en:milk-substitutes,en:plant-based-beverages,en:plant-based-milk-alternatives,en:cereal-based-drinks,en:oat-based-drinks	Ecológico, FSC, FSC Mixto, Sin azúcares añadidos	en:organic,en:fsc,en:fsc-mix,en:no-added-sugar	España	en:spain			0																															100g	100g			48	kcal	0.9	g	0.2	g	8.4	g	5.5	g			1.2	g	0.04	g	0.016	g			48	kcal																																																																																																	en:plant-based-milk-substitutes	en:beverages,en:plant-based-milk-substitutes		unknown	b	1	c	52	1	18905	-5	-15	1	0															App - elcoco, Apps, App - yuka, App - El CoCo
8433329109321			es					Bio bebida de avena con cacao																											El Corte Ingles	el-corte-ingles		Alimentos y bebidas de origen vegetal, Bebidas, Alimentos de origen vegetal, Cereales y patatas, en:Dairy substitutes, Cereales y derivados, Sustitutos de la leche, Bebidas de origen vegetal, Bebidas vegetales, Bebidas de cereales, Bebidas de avena, en:Cocoa oat-based drinks	en:plant-based-foods-and-beverages,en:beverages,en:plant-based-foods,en:cereals-and-potatoes,en:dairy-substitutes,en:cereals-and-their-products,en:milk-substitutes,en:plant-based-beverages,en:plant-based-milk-alternatives,en:cereal-based-drinks,en:oat-based-drinks,en:cocoa-oat-based-drinks	Sin gluten, Ecológico, Ecológico UE, FSC, FSC Mixto	en:no-gluten,en:organic,en:eu-organic,en:fsc,en:fsc-mix	España	en:spain	El Corte Inglés	el-corte-ingles	0																															100g	100g			55	kcal	1.2	g	0.2	g	9.8	g	7.1	g			1.1	g	0.07	g	0.028	g			55	kcal																																																																																																	en:plant-based-milk-substitutes	en:beverages,en:plant-based-milk-substitutes		unknown	b	1	b	67	1	18905	-5	-15	1	15															App - yuka, Apps
8423352106152			es					Yosoy																											Yosoy	yosoy		Alimentos y bebidas de origen vegetal, Bebidas, Alimentos de origen vegetal, Cereales y patatas, en:Dairy substitutes, Cereales y derivados, Sustitutos de la leche, Bebidas de origen vegetal, Bebidas vegetales, Bebidas de cereales, Bebidas de avena	en:plant-based-foods-and-beverages,en:beverages,en:plant-based-foods,en:cereals-and-potatoes,en:dairy-substitutes,en:cereals-and-their-products,en:milk-substitutes,en:plant-based-beverages,en:plant-based-milk-alternatives,en:cereal-based-drinks,en:oat-based-drinks	FSC, FSC Mixto, Sin aditivos	en:fsc,en:fsc-mix,en:no-additives	España	en:spain			0																															100g	100g			46	kcal	0.8	g	0.1	g	8.1	g	5.4	g	0.6	g	1.4	g							46	kcal																																																																																																	en:plant-based-milk-substitutes	en:beverages,en:plant-based-milk-substitutes		unknown	unknown		c	52	1	18905	-5	-15	1	0															App - elcoco, Apps, App - yuka, App - El CoCo
