code	producer_version_id	lc	product_name_ar	product_name_de	product_name_en	product_name_es	product_name_fi	product_name_fr	product_name_pt	product_name_ro	abbreviated_product_name_fr	generic_name_de	generic_name_en	generic_name_es	generic_name_fr	generic_name_pt	generic_name_sv	quantity	serving_size	packaging	packaging_tags	brands	brands_tags	categories	categories_tags	labels	labels_tags	countries	countries_tags	stores	stores_tags	obsolete	obsolete_since_date	origins	origins_tags	origin_es	manufacturing_places	manufacturing_places_tags	emb_codes	emb_codes_tags	ingredients_text_de	ingredients_text_en	ingredients_text_es	ingredients_text_fi	ingredients_text_fr	ingredients_text_it	ingredients_text_pt	ingredients_text_ro	ingredients_text_sv	allergens	allergens_tags	traces	traces_tags	nutrition_data_per	nutrition_data_prepared_per	energy-kj_value	energy-kj_unit	energy-kcal_value	energy-kcal_unit	fat_value	fat_unit	saturated-fat_value	saturated-fat_unit	carbohydrates_value	carbohydrates_unit	sugars_value	sugars_unit	fiber_value	fiber_unit	proteins_value	proteins_unit	salt_value	salt_unit	sodium_value	sodium_unit	energy_value	energy_unit	monounsaturated-fat_value	monounsaturated-fat_unit	polyunsaturated-fat_value	polyunsaturated-fat_unit	trans-fat_value	trans-fat_unit	cholesterol_value	cholesterol_unit	added-sugars_value	added-sugars_unit	polyols_value	polyols_unit	vitamin-a_value	vitamin-a_unit	vitamin-d_value	vitamin-d_unit	fruits-vegetables-nuts-dried_value	fruits-vegetables-nuts-dried_unit	cocoa_value	cocoa_unit	packaging_1_number_of_units	packaging_1_shape	packaging_1_material	packaging_1_recycling	packaging_1_quantity_per_unit	packaging_2_number_of_units	packaging_2_shape	packaging_2_material	packaging_2_quantity_per_unit	conservation_conditions_fr	customer_service_fr	link	off:food_groups	off:food_groups_tags	off:nova_groups	off:nova_groups_tags	off:nutriscore_grade	off:nutriscore_score	off:ecoscore_grade	off:ecoscore_score	off:ecoscore_data.missing_key_data	off:ecoscore_data.agribalyse.code	off:ecoscore_data.adjustments.origins_of_ingredients.value	off:ecoscore_data.adjustments.packaging.value	off:ecoscore_data.adjustments.packaging.non_recyclable_and_non_biodegradable_materials	off:ecoscore_data.adjustments.production_system.value	off:ecoscore_data.adjustments.threatened_species.value	sources_fields:org-database-usda:available_date	sources_fields:org-database-usda:fdc_category	sources_fields:org-database-usda:fdc_data_source	sources_fields:org-database-usda:fdc_id	sources_fields:org-database-usda:modified_date	sources_fields:org-database-usda:publication_date	sources_fields:org-gs1:gln	sources_fields:org-gs1:gpcCategoryCode	sources_fields:org-gs1:gpcCategoryName	sources_fields:org-gs1:isAllergenRelevantDataProvided	sources_fields:org-gs1:lastChangeDateTime	sources_fields:org-gs1:partyName	sources_fields:org-gs1:productionVariantDescription	sources_fields:org-gs1:publicationDateTime	data_sources
7622300108137		en						Milkinis		Milkinis												Milka	milka	Snacks, Sweet snacks, Cocoa and its products, Confectioneries, Bars, Chocolate candies, Cereal bars, Chocolates, Candy chocolate bars, Chocolate cereal bars, Filled chocolates, Chocolate confectionery with dairy filling	en:snacks,en:sweet-snacks,en:cocoa-and-its-products,en:confectioneries,en:bars,en:chocolate-candies,en:cereal-bars,en:chocolates,en:candy-chocolate-bars,en:chocolate-cereal-bars,en:filled-chocolates,en:chocolate-confectionery-with-dairy-filling			France, Spain	en:france,en:spain			0										"chocolate con leche de les alpes con relleno (50%) cremoso lácteo, ingredients: azúcar, palm fat, suero de ledche en polvo, leche desnatada en polvo, cacao mantle, cocoa paste, leche fat, emuigente (lecithin de soja, lecithin de gyrasol), aromas, avellanas moldas, 7% leche desnatada en polvo en el relleno aremoso lácteo, puede contener otros frutos de cáscara y trigo,   o alpesi tejcsokoládé tejes krémmel töltve (50%), összetevők: cukor, pálmaolaj, tejsavópor, sovány tejpor, kakaóvaj, kakaómassza, tejzsír, emulseálószerek (szójalecitin, napraforg ó lecithin), aromák, mogyorómassza, a tejes krém 7% sovány tejport tartalmaz, tartallamhat egyéb dióféléket és búzát, o chocolate with alpine milk filled with cream (50%) milk, ingredients: sugar, vegetable palm oil, whey powder (from milk), skimmed milk powder,   cocoa butter, cocoa mass, milk fat, emulsifiers (soy lecithin, sunflower lecithin), cl flavors, hazelnut paste, milk cream contains 7% skimmed milk powder, can fib pro contains similar varieties of nuts and wheat, mondelez españa commercial, s,l, c/eucalypto, 25 28016 madrid, españa, www,mondezinternational,es sal/ mondelēz, forgalmazza: mondelez hungária kft,, 1117 budapest, * inges * reference *consum neumann jános u,   1/e iv, emelet fogyasztói szolgálat: 06 80 200 500 dijmensen hivható,, www,milka,hu mondelez romania s,a,, b-dul dimitrie pompeiu no, 5-7, sector 2, 020335 bucharest, romania, tel, 021 2330405 consumator@mdiz,com, www,milka ,en international 1 barrita 1 szelet 1 barar aqut itt nyilik/open alad e87,5 g®x 10,94 g) conservar en helyen tartan"						"Chocolate con leche de les Alpes con relleno (50%) cremoso lácteo, Ingredientes: Azúcar, grasa de palma, suero de ledche en polvo, leche desnatada en polvo, manteca de cacao, pasta de cacae, grasa de leche, emuigente (lecitina de soja, lecitina de girasol), aromas, avellanas molidas, 7% leche desnatada en polvo en el relleno aremoso lácteo, Puede contener otros frutos de cáscara y trigo, O Alpesi tejcsokoládé tejes krémmel töltve (50%), Összetevők: cukor, pálmaolaj, tejsavópor, sovány tejpor, kakaóvaj, kakaómassza, tejzsír, emulgeálószerek (szójalecitin, napraforgó lecitin), aromák, mogyorómassza, A tejes krém 7% sovány tejport tartalmaz, Tartalmazhat egyéb dióféléket és búzát, O Ciocolată cu lapte alpin umplută cu cremă (50%) de lapte, Ingrediente: zahăr, ulei vegetal de palmier, zer praf (din lapte), lapte praf degresat, unt de cacao, masă de cacao, grăsime din lapte, emulsifianți (lecitină din soia, lecitină din floarea soarelui), CL arome, pastă de alune de pădure, Crema de lapte conține 7% lapte praf degresat, Poate Fib Pro conține varietăți similare de nuci și grâu, Mondelez España Commercial, S,L, C/Eucalipto, 25 28016 Madrid, España, www,mondelezinternational,es Sal/ Mondelēz, Forgalmazza: Mondelez Hungária Kft,, 1117 Budapest, * Inges * Refere *Consum Neumann János u, 1/E IV, emelet Fogyasztói szolgálat: 06 80 200 500 Dijmentesen hivható,, www,milka,hu Mondelez Romania S,A,, B-dul Dimitrie Pompeiu nr, 5-7, sector 2, 020335 București, România, tel, 021 2330405 consumator@mdiz,com, www,milka,ro International 1 barrita 1 szelet 1 baton Abrir aqut Itt nyilik/Deschide aled e87,5 g®x 10,94 g) Conservar en helyen tartan"		Gluten, Milk, Soybeans	en:gluten,en:milk,en:soybeans			100g	100g			578	kcal	38	g	22	g	52	g	52	g			5.1	g	0.38	g	0.152	g	578	kcal																																	en:chocolate-products	en:sugary-snacks,en:chocolate-products	4	en:4-ultra-processed-food-and-drink-products	e	28	d	24	1	31012	-5	-15	1	0	-10															App - elcoco, App - yuka, Apps, App - El CoCo, App - InFood
5000159557542		fr				Bounty 5x2												285 g	28.5 g			Bounty	bounty	Snacks, Snacks sucrés, Cacao et dérivés, Confiseries, Barres, Biscuits et gâteaux, Confiseries chocolatées, Barres chocolatées, Barre au chocolat sans biscuit	en:snacks,en:sweet-snacks,en:cocoa-and-its-products,en:confectioneries,en:bars,en:biscuits-and-cakes,en:chocolate-candies,en:candy-chocolate-bars,en:coated-chocolate-bar-without-biscuit			France, Espagne	en:france,en:spain			0																						100g	100g	2035	kJ	487	kcal	25	g	21	g	60	g	46	g			3.8	g	0.26	g	0.104	g	2035	kJ																																	en:biscuits-and-cakes	en:sugary-snacks,en:biscuits-and-cakes		unknown	e	27	d	39	1	31001	-5	-15	1	0																App - smoothie-openfoodfacts, Apps
5900951313592		es			Twix	Twix												50g	1 portion (25 g)			Twix	twix	Botanas, Snacks dulces, Cacao y sus productos, Dulces, Barritas, Dulces de chocolate, Barritas de chocolate, en:Chocolate biscuity bars	en:snacks,en:sweet-snacks,en:cocoa-and-its-products,en:confectioneries,en:bars,en:chocolate-candies,en:candy-chocolate-bars,en:chocolate-biscuity-bars	Sin colorantes	en:no-colorings	España	en:spain			0											"AZÚCAR, JARABE DE GLUCOSA, HARINA DE TRIGO (17%), GRASA DE PALMA, MANTECA DE CACAO, LECHE DESCREMADA EN POLVO, PASTA DE CACAO, LACTOSA, GRASA DE MANTEQUILLA (DE LA LECHE), POLVO DE SUERO (DE LA LECHE), CACAO MAGRO EN POLVO, SAL, EMULGENTE (LECITINA DE SOJA), GASIFICANTE (E500), EXTRACTO NATURAL DE VAINILLA. SIN COLORANTES, CONSERVANTES NI AROMAS ARTIFICIALES."		"Biscuit  (26%), nappage au caramel (32%), enrobé de chocolat au lait (35%), sucre, sirop de glucose, farine de blé, matière grasse de palme, lait écrémé en poudre, beurre de cacao, pâte de cacao, permeat de lactosérum, matière grasse du lait, cacao maigre en poudre, sel, émulsifiant (lécithine de soja), poudre à lever (E500), arôme"					Gluten, Leche, Soja	en:gluten,en:milk,en:soybeans			serving	100g	515	kJ	123	kcal	5.9	g			16	g					1.2	g					515	kJ																																	en:biscuits-and-cakes	en:sugary-snacks,en:biscuits-and-cakes	4	en:4-ultra-processed-food-and-drink-products	unknown		d	23	1	31000	-5	-15	1	0	-10															App - smoothie-openfoodfacts, Apps, App - macrofactor
5391532121710		en			Salted caramel protein bar			Chocolate Salted Caramel Flavour Vitamin & Protein Bar										55g	55 g	Plastic	en:plastic	Fulfil	fulfil	Snacks, Sweet snacks, Cocoa and its products, Confectioneries, Bars, Chocolate candies, Dietary supplements, Bodybuilding supplements, Candy chocolate bars, Caramel chocolate cookie bars, Energy bars, Protein bars	en:snacks,en:sweet-snacks,en:cocoa-and-its-products,en:confectioneries,en:bars,en:chocolate-candies,en:dietary-supplements,en:bodybuilding-supplements,en:candy-chocolate-bars,en:caramel-chocolate-cookie-bars,en:energy-bars,en:protein-bars			France, Spain	en:france,en:spain	Casino	casino	0										milk protein, milk chocolate with sweetener 25% (sweetener (matitol,cocoa beure, milk powder, cocoa mass, emulsifier (soy lecithin, ardmel, collagen hydrolysate, humectant (glycerol), isomalto-oligosaccharide, water, soy chips soy chips soy soy protein flat, tapioca starch, barley malt extract (gluten), salt), palm fat, white chocolate with sweetener 10% (sweetener (maltitol),  cocoa butter, milk powder, natural aróme soy lecithin emulsifying), chocolate powder (cocoa powder, carao mass, sugar), natural flavour, salt, vitamins (vitamin clacide ascorbic), vitamin e (tocopherol acetate, vitamin b6 pyridoxine ictiorhydrate), vitamin b12 (cyanocobalamin), vitamin b1 (thiamine) witamine 82 fibotlavinel niacin, pantothenic acid, folic acid), sweetener (sucralose)			protéine de lait, chocolat au lait avec édulcorant 25% (édulcorant (matitol,beure de cacao, lait en poudre, masse de cacao, émulsifiant (lécithine de sojal, ardmel, hydrolysat de collagène, humectant (glycérol), isomalto-oligosaccharide, eau, chips de soja lioplat de protéine de soja, amidon de tapioca, extrait de malt d'orge (gluten), sel), graisse de palme, chocolat blanc avec edulcorant 10% (édulcorant (maltitol), beurre de cacao, lait en poudre, émulsifant lécithine de sojal aróme naturel), chocolat en poudre (cacao en poudre, masse de carao, sucre), arôme naturel, sel, vitamines (vitamine Clacide ascorbique), vitamine E (acétate de tocophérol, vitamine B6 ictiorhydrate de pyridoxine), vitamine B12 (cyanocobalamine), vitamine B1 (thiamine) witamine 82 fibotlavinel niacine, acide pantothénique, acide folique), édulcorant (sucralose)					Gluten, Milk, Soybeans	en:gluten,en:milk,en:soybeans	Eggs, Gluten, Nuts, Peanuts	en:eggs,en:gluten,en:nuts,en:peanuts	serving	100g	1549	kJ	205	kcal	8.4	g	4.8	g	16	g	1.4	g	2.6	g	20	g	0.62	g	0.248	g	1549	kJ																							en:plastic									https://fulfilnutrition.com/products/chocolate-salted-caramel	en:biscuits-and-cakes	en:sugary-snacks,en:biscuits-and-cakes	4	en:4-ultra-processed-food-and-drink-products	d	16	unknown				-5	-10	1	0	-10															App - yuka, Apps, App - El CoCo, App - Open Food Facts, App - InFood, App - smoothie-openfoodfacts, App - Waistline
8402001022043		es			Barritas Caocrem	Barritas Caocrem												105 g	21g			Hacendado	hacendado	Botanas, Snacks dulces, Cacao y sus productos, Dulces, Barritas, Dulces de chocolate, Barritas de chocolate	en:snacks,en:sweet-snacks,en:cocoa-and-its-products,en:confectioneries,en:bars,en:chocolate-candies,en:candy-chocolate-bars			España	en:spain	Hacendado	hacendado	0										cocoa biscuit filling and coating (90%) [sugar, vegetable fat (palm, sunflower, rapeseed), fully hydrogenated vegetable fat (palm kernel), cocoa biscuit (11.5%) (wheat flour (gluten), sugar, high oleic sunflower oil, defatted cocoa powder (7%), glucose and fructose syrup, raising agents (sodium acid carbonate, ammonium acid carbonate, potassium carbonate, sodium carbonate),  salt, emulsifier (soy lecithin), flavouring), skimmed milk powder, whey powder (milk), lactose (milk), salt, emulsifier (soy lecithin), flavouring], wheat flour (gluten), corn starch, emulsifier (soy lecithin), wheat fibre (gluten), salt, defatted cocoa powder, caramelised sugar syrup, raising agents (sodium bicarbonate, ammonium bicarbonate), palm oil, malt flour (gluten),  natural vanilla scent,	Relleno y cobertura de galleta de cacao (90%) [azúcar, grasa vegetal (palma, girasol, colza), grasa vegetal totalmente hidrogenada (palmiste), galleta de cacao (11,5%) (harina de trigo (gluten), azúcar, aceite de girasol alto oleico, cacao desgrasado en polvo (7%), jarabe de glucosa y fructosa, gasificantes (carbonato ácido de sodio, carbonato ácido de amonio, carbonato potásico, carbonato sódico), sal, emulgente (lecitina de soja), aroma), leche desnatada en polvo, suero lácteo en polvo (leche), lactosa (leche), sal, emulgente (lecitina de soja), aroma], harina de trigo (gluten), almidón de maíz, emulgente (lecitina de soja), fibra de trigo (gluten), sal, cacao desgrasado en polvo, jarabe de azúcar caramelizado, gasificantes (bicarbonato sódico, bicarbonato amónico), aceite de palma, harina de malta (gluten), aroma natural de vainilla,							Gluten, Leche, Soja	en:gluten,en:milk,en:soybeans			serving	100g	497	kJ	119	kcal	7.4	g	5	g	12	g	9.1	g			1	g	0.105	g	0.042	g	497	kJ																																	en:biscuits-and-cakes	en:sugary-snacks,en:biscuits-and-cakes	4	en:4-ultra-processed-food-and-drink-products	e	28	unknown		1		-5	-15	1	0	-10															App - smoothie-openfoodfacts, Apps, App - InFood
7790580111755		es				Cofler Graffiti								oblea con relleno sabor chocolate cubierta con chocolate con leche y baño de repostería fantasí rojo, azul y amarillo.				45 g	1 paquete/pack 45 g			Arcor,Cofler	arcor,cofler	Botanas, Snacks dulces, Cacao y sus productos, Dulces, Barritas, Galletas y pasteles, Dulces de chocolate, Galletas, Chocolates, Galletas de chocolate, Chocolates con leche, en:Wafers, Barritas de chocolate, Obleas rellenas, en:Chocolate biscuity bars, en:Chocolate stuffed wafers, en:Flavoured chocolates, en:Flavoured milk chocolates	en:snacks,en:sweet-snacks,en:cocoa-and-its-products,en:confectioneries,en:bars,en:biscuits-and-cakes,en:chocolate-candies,en:biscuits,en:chocolates,en:chocolate-biscuits,en:milk-chocolates,en:wafers,en:candy-chocolate-bars,en:stuffed-wafers,en:chocolate-biscuity-bars,en:chocolate-stuffed-wafers,en:flavoured-chocolates,en:flavoured-milk-chocolates	Punto Verde, Exceso en azúcares, Exceso en calorías, Exceso en grasas saturadas, Exceso en grasas totales	en:green-dot,es:exceso-en-azucares,es:exceso-en-calorias,es:exceso-en-grasas-saturadas,es:exceso-en-grasas-totales	Argentina, Bolivia, México, Paraguay, Perú, España, Uruguay	en:argentina,en:bolivia,en:mexico,en:paraguay,en:peru,en:spain,en:uruguay	Farmacorp	farmacorp	0		Argentina	en:argentina		Arroyito,Córdoba,Argentina	arroyito,cordoba,argentina	RNE 04002852 (CC) - 19-002186 (SL),RNPA 04080250,080503190006,RFC UME941006L77,RE 800026608/1,RSPA 059121,IM SRA 1409/8280	rne-04002852-cc-19-002186-sl,rnpa-04080250,080503190006,rfc-ume941006l77,re-800026608-1,rspa-059121,im-sra-1409-8280			"AZÚCAR; MANTECA DE CACAO; LECHE ENTERA EN POLVO; LECHE DESCREMADA EN POLVO; HARINA DE TRIGO ENRIQUECIDA (HIERRO 0.0030%, ÁCIDO FÓLICO 0.00022%, TIAMINA 0.00063%, RIBOFLAVINA 0.00013%, NIACINA 0.0013%); MASA DE CACAO; ACEITES VEGETALES (PALMA INTERESTIFICADO Y FRACCIONADO, GIRASOL ALTO OLEICO, SOJA HIDROGENADO); CACAO EN POLVO; PERMEADO DE SUERO DE LECHE EN POLVO; SAL; EMULSIONANTE (LECITINA DE SOJA); LEUDANTE QUÍMICO (BICARBONATO DE SODIO); AROMATIZANTES ARTIFICIALES (VAINILLA, LECHE, VAINILLINA); COLORANTES (ROJO ALLURA (INS 129), TARTRAZINA (INS 102), AZUL BRILLANTE (INS 133))."							Gluten, Leche, Soja, Tartrazina	en:gluten,en:milk,en:soybeans,es:tartrazina	Frutos de cáscara, Cacahuetes	en:nuts,en:peanuts	100g	100g	2224	kJ	532	kcal	30	g	18	g	56	g	49	g	2	g	8.8	g	0.295	mg	0.118	mg	2224	kJ	11	g	1.2	g	0.3	g	0.0097	mg	40	g									27	g	1	en:bag	en:pp-5-polypropylene	en:recycle								https://www.arcor.com/	en:chocolate-products	en:sugary-snacks,en:chocolate-products	4	en:4-ultra-processed-food-and-drink-products	e	24	c	41		24311	-3	-8	0	0																App - elcoco, Apps, App - El CoCo, App - smoothie-openfoodfacts
5000159461122		en	"سنيكرز"									Milchschokolade, gefüllt mit feiner Candy-Creme, Karamell und gerösteten Erdnüssen	Milk chocolate with soft nougat and caramel centre with fresh roasted peanuts		Chocolat au lait fourré de confiserie et de caramel, avec des cacahuètes grillées	Chocolate de leite com nogado, recheado de caramelo e amendoins torrados	Mjölkchoklad med vit nougat (16%), mjuk kola (27%) och rostade jordnötter 22%	50 g	50 g	Plastic, Wrapper	en:plastic,en:wrapper	Snickers	snickers	Snacks, Sweet snacks, Cocoa and its products, Confectioneries, Bars, Chocolate candies, Candy chocolate bars, Caramel chocolate bars, Chocolate confectionery with dairy filling	en:snacks,en:sweet-snacks,en:cocoa-and-its-products,en:confectioneries,en:bars,en:chocolate-candies,en:candy-chocolate-bars,en:caramel-chocolate-bars,en:chocolate-confectionery-with-dairy-filling	Green Dot, Tidy man	en:green-dot,fr:tidy-man	Algeria, Belgium, Bulgaria, Cyprus, Denmark, France, Germany, Hungary, Luxembourg, Mexico, Morocco, Netherlands, Poland, Portugal, Romania, Saudi Arabia, Serbia, Singapore, Spain, Sweden, Switzerland, United Kingdom, United States	en:algeria,en:belgium,en:bulgaria,en:cyprus,en:denmark,en:france,en:germany,en:hungary,en:luxembourg,en:mexico,en:morocco,en:netherlands,en:poland,en:portugal,en:romania,en:saudi-arabia,en:serbia,en:singapore,en:spain,en:sweden,en:switzerland,en:united-kingdom,en:united-states	Amazon,Coop	amazon,coop	0									Zucker, Glukosesirup, Erdnüsse, Magermilchpulver, Kakaobutter, Kakaomasse, Sonnenblumenöl, Butterreinle (Milch) Milchzucker, Molkeper	Milk Chocolate (sugar, cocoa butter, chocolate, skim milk, lactose, milkfat, soy lecithin), peanuts, corn syrup, sugar, palm oil, skim milk, lactose, salt, egg whites, artificial flavor.			"Sucre, sirop de glucose, _cacahuètes_, _lait_ écrémé en poudre, beurre de cacao, pâte de cacao, huile de tournesol, _lactose_, matière grasse du _lait_, petit-_lait_ en poudre, matière grasse de palme, sel, émulsifiant (lécithine de _soja_), blanc d’_œuf_ en poudre, protéine de _lait_, extrait naturel de vanille."		Açúcar, xarope de glucose, _amendoins_, _leite_ magro em pó, manteiga de cacau, pasta de cacau, óleo de girassol, _lactose_, gordura do_leite_, soro de _leite_ em pó, óleo de palma, sal, emulsionante (lecitina de _soja_), clara de _ovo_ em pó, proteína de _leite_, extracto natural de baunilha.		Socker, glukossirap, _jordnötter_, _skummjölkspulver_, kakaosmör, kakaomassa, solrosolja, _laktos_, _mjölk_, _vasslepulver_ (_mjölk_), _palmfett_, salt, emulgeringsmedel emulgator (_sojalecitin_),_ äggvitepulver_, _mjölkprotein_, naturlig vaniljextrakt.	Eggs, Milk, Peanuts, Soybeans	en:eggs,en:milk,en:peanuts,en:soybeans	Nuts	en:nuts	100g	100g	2018	kJ	481	kcal	22.5	g	7.9	g	60.5	g	51.8	g	4.3	g	8.6	g	0.62875	g	0.2515	g	2018	kJ							0.0067	g					0	g	0	g					1	en:wrapper	en:plastic	en:recycle									en:biscuits-and-cakes	en:sugary-snacks,en:biscuits-and-cakes	4	en:4-ultra-processed-food-and-drink-products	e	21	d	29		31012	-5	-10	1	0	-10															Database - FoodRepo / openfood.ch, Databases, App - yuka, Apps, App - InFood, App - Open Food Facts, App - Horizon, App - smoothie-openfoodfacts, App - Speisekammer, App - macrofactor
5999076228782		en			Crush Protein Bar Cookies & Cream	Crush Protein Bar Cookies & Cream							milk chocolate coated crunchy high-protein bar with caramel flavoured layer and sweetener.	barrita protéica crujiente con cobertura de chocolate con leche y capa de caramelo, con edulcorante, sabor cookies & cream.				64 g				BioTechUSA,Crush	biotechusa,crush	Snacks, Sweet snacks, Cocoa and its products, Confectioneries, Bars, Chocolate candies, Chocolates, Chocolates with sweeteners, Dietary supplements, Milk chocolates, Bodybuilding supplements, Candy chocolate bars, Caramel chocolate bars, Milk chocolate bar without sugar with sweeteners, Protein bars	en:snacks,en:sweet-snacks,en:cocoa-and-its-products,en:confectioneries,en:bars,en:chocolate-candies,en:chocolates,en:chocolates-with-sweeteners,en:dietary-supplements,en:milk-chocolates,en:bodybuilding-supplements,en:candy-chocolate-bars,en:caramel-chocolate-bars,en:milk-chocolate-bar-without-sugar-with-sweeteners,en:protein-bars	Source of proteins, High proteins, Made in the EU, No added sugar, No palm oil	en:source-of-proteins,en:high-proteins,en:made-in-the-eu,en:no-added-sugar,en:no-palm-oil	Bolivia, Spain	en:bolivia,en:spain	Fitmass Nutrition	fitmass-nutrition	0		European Union, Hungary	en:european-union,en:hungary	Soja extruída no UE	Hungría	hungria	080503190226	080503190226		Milk chocolate coating with sweetener 31% [sweetener (maltitols), cocoa butter, whole milk powder, cocoa mass, emulsifier (lecithins (soy)), vanilla extract], caramel flavoured layer 18% [sweetener (maltitols), condensed milk, cocoa butter, humectant (sorbitols), emulsifier (mono - and diglycerides of fatty acids), flavouring, salt, colour (plain caramel)], milk protein, soy crispies 8.6% (soy protein, rice flour, barley malt extract, salt), collagen hydrolysate, humectant (glycerol), water, soy protein, coconut fat, flavouring (milk).	Cobertura de chocolate de leche con edulcorante 31% [edulcorante (maltitoles), manteca de cacao, leche entera en polvo, masa de cacao, emulgente (lecitinas (soja)), aroma natural], capa con sabor a caramelo con edulcorante 18% [edulcorante (maltitoles), leche condensada, manteca de cacao, humectante (sorbitol), emulgente (mono y diglicéridos de ácidos grasos), aroma, sal, colorante (caramelo)], proteína de leche, soja extruida 8.6% (aislado de proteína de soja, harina de arroz, extracto de cebada malteada, sal), hidrolizado de colágeno, humectante (glicerina), agua potable, aislado de proteína de soja, aceite de coco, aroma (leche).							Gluten, Milk, Soybeans	en:gluten,en:milk,en:soybeans	Eggs, Nuts, Peanuts	en:eggs,en:nuts,en:peanuts	100g	100g	1566	kJ	375	kcal	17	g	11	g	36	g	3.4	g			31	g	0.53	g	0.212	g	1566	kJ									0	g	30	g									1	en:bag	en:o-7-other-plastics	en:recycle								https://shop.biotechusa.com/products/crush-bar	en:chocolate-products	en:sugary-snacks,en:chocolate-products	4	en:4-ultra-processed-food-and-drink-products	d	16	d	26		31020	-3	-10	1	0																App - yuka, Apps, App - El CoCo, App - macrofactor
7310511251604		fi				Marabou	Pigall											40g	20g			Marabou	marabou	Naposteltavat, Makeat naposteltavat, en:Cocoa and its products, Sokerileipomotuotteet, Patukat, Suklaamakeiset, Suklaat, Maitosuklaat, Suklaapatukat	en:snacks,en:sweet-snacks,en:cocoa-and-its-products,en:confectioneries,en:bars,en:chocolate-candies,en:chocolates,en:milk-chocolates,en:candy-chocolate-bars	Cocoa Life	en:cocoa-life	Suomi, Espanja	en:finland,en:spain	Kärkkäinen,Prisma	karkkainen,prisma	0												Sokeri, kasviöljyt (palmuydin, kookos), kaakaovoi, riisimurot 7,5% (riisijauho, sokeri, suola, E471), kaakaomassa, rasvaton maitojauhe, herajauhe (maito), voiöljy, hasselpähkinät, vähärasvainen kaakao, emulgointiaineet (soijalesitiinit, E476), suola, aromit. Saattaa sisältää maapähkinää, muuta pähkinää, munaa ja vehnää.						Maito, Pähkinät, Soija	en:milk,en:nuts,en:soybeans	Munat, Gluteeni, Pähkinät, Maapähkinät	en:eggs,en:gluten,en:nuts,en:peanuts	100g	100g	2575	kJ	620	kcal	46	g	36	g	48	g	42	g	1.3	g	3.1	g	0.17	g	0.068	g	2575	kJ																					1	fi:kääre	en:pp-5-polypropylene	fi:muovinkeräys									en:chocolate-products	en:sugary-snacks,en:chocolate-products	4	en:4-ultra-processed-food-and-drink-products	e	25	e	16		31004	-5	-8	0	0	-10															App - Yuka, Apps, App - smoothie-openfoodfacts
